Category,Insight,Significance
Interest Rates,The RBA cash rate as of May 2026 is 4.31%.,High
Interest Rates,The cash rate has risen by 0.46 percentage points over the past 12 months.,Medium
Inflation,Australian CPI inflation is 4.1% YoY — outside the RBA 2–3% target band.,High
Employment,Australian unemployment is 4.5% — moderate by historical standards.,Medium
Economic Regime,Latest economic regime classification: 'Moderate Growth' (Q1 2026),Medium
Economic Health,"Australia's composite health score is 75/100 (Good), declined from 81 a year ago.",Medium
Housing,Current spread: owner-occupier mortgage rate (6.00%) is 1.69pp above the cash rate (4.31%).,Medium
AU vs NZ,In 2024: Australia GDP growth 1.4% vs NZ 1.3%. Australia growing faster.,Medium
